subject,chapter,topic,question_text,question_image_url,option_a,option_b,option_c,option_d,option_e,option_f,option_g,option_h,correct_option,explanation,image_url,question_type
Anatomy,Upper Limb,Shoulder Joint,Which muscle is the primary abductor of the shoulder joint?,,Deltoid,Pectoralis Major,Latissimus Dorsi,Trapezius,,,,,A,The deltoid muscle is the primary abductor of the shoulder joint.,,easy
Anatomy,Upper Limb,Shoulder Joint,The rotator cuff consists of how many muscles?,,2,3,4,5,,,,,C,The rotator cuff consists of 4 muscles: Supraspinatus Infraspinatus Teres Minor and Subscapularis.,,easy
Anatomy,Lower Limb,Knee Joint,Identify the ligament marked in the image.,https://example.com/images/knee_diagram.png,Posterior Cruciate Ligament,Anterior Cruciate Ligament,Medial Collateral Ligament,Lateral Collateral Ligament,,,,,B,The ACL prevents anterior displacement of the tibia on the femur.,https://example.com/images/knee_answer.png,moderate
Physiology,Cardiovascular,Heart,What is the normal resting heart rate for an adult?,,40-60 bpm,60-100 bpm,100-120 bpm,120-140 bpm,,,,,B,The normal resting heart rate for an adult is 60-100 beats per minute.,,easy
Biochemistry,Enzymes,,What is the function of enzymes in biochemical reactions?,,They provide energy,They lower activation energy,They increase temperature,They change equilibrium,They denature proteins,,,,B,Enzymes are biological catalysts that lower the activation energy of biochemical reactions.,,easy
Pharmacology,General Pharmacology,Drug Absorption,Which route of drug administration has 100% bioavailability?,,Oral,Sublingual,Intravenous,Intramuscular,Rectal,Transdermal,,,C,IV administration has 100% bioavailability.,,easy
Pathology,General Pathology,Inflammation,Which cells are the first to arrive at the site of acute inflammation?,,Macrophages,Neutrophils,Lymphocytes,Eosinophils,Basophils,Monocytes,Mast Cells,,B,Neutrophils are the first cells to arrive at the site of acute inflammation.,https://example.com/images/inflammation.png,moderate
Microbiology,Bacteriology,Gram Staining,Refer to the image and identify the Gram-positive organism.,https://example.com/images/gram_stain.png,E. coli,Staphylococcus aureus,Pseudomonas,Klebsiella,Proteus,Salmonella,Shigella,Neisseria,B,Staphylococcus aureus is a Gram-positive coccus.,https://example.com/images/gram_answer.png,difficult
