country,code,courses,college,city,type
China,CN,"AMC,PLAB,FMGE/NExT,NEET PG",Shaoxing University Medical College,Shaoxing,university
China,CN,"AMC,PLAB,FMGE/NExT,NEET PG",Shenyang Medical College,Shenyang,university
China,CN,"AMC,PLAB,FMGE/NExT,NEET PG",Shenzhen University College of Medicine,Shenzhen,university
China,CN,"AMC,PLAB,FMGE/NExT,NEET PG",Shihezi University School of Medicine,Shihezi,university
China,CN,"AMC,PLAB,FMGE/NExT,NEET PG",Soochow University Medical College,Suzhou,university
China,CN,"AMC,PLAB,FMGE/NExT,NEET PG",Southeast University Medical College,Nanjing,university
China,CN,"AMC,PLAB,FMGE/NExT,NEET PG",Southern Medical University,Guangzhou,university
China,CN,"AMC,PLAB,FMGE/NExT,NEET PG",Southwest Medical University,Luzhou,university
China,CN,"AMC,PLAB,FMGE/NExT,NEET PG",Sun Yat-sen University School of Medicine,Shenzhen,university
China,CN,"AMC,PLAB,FMGE/NExT,NEET PG",Taizhou University Medical School,Taizhou,university
China,CN,"AMC,PLAB,FMGE/NExT,NEET PG",Tianjin Medical University Clinical Medical College,Tianjin,university
China,CN,"AMC,PLAB,FMGE/NExT,NEET PG",Tianjin Medical University School of Basic Medical Sciences,Tianjin,university
China,CN,"AMC,PLAB,FMGE/NExT,NEET PG",Tianjin Second Medical College,Tianjin,university
China,CN,"AMC,PLAB,FMGE/NExT,NEET PG",Tibet University Medical College,Lhasa,university
China,CN,"AMC,PLAB,FMGE/NExT,NEET PG",Tongji Medical College of Huazhong University of Science & Technology,Wuhan,university
China,CN,"AMC,PLAB,FMGE/NExT,NEET PG",Tongji University School of Medicine,Shanghai,university
China,CN,"AMC,PLAB,FMGE/NExT,NEET PG",Tsinghua University School of Medicine,Beijing,university
China,CN,"AMC,PLAB,FMGE/NExT,NEET PG",University of South China Faculty of Medicine,Hengyang,university
China,CN,"AMC,PLAB,FMGE/NExT,NEET PG",Wannan Medical College,Wuhu,university
China,CN,"AMC,PLAB,FMGE/NExT,NEET PG",Wenzhou Medical University,Wenzhou,university
China,CN,"AMC,PLAB,FMGE/NExT,NEET PG","West China School of Medicine, Sichuan University",Chengdu,university
China,CN,"AMC,PLAB,FMGE/NExT,NEET PG",Wuhan University School of Medicine,Wuhan,university
China,CN,"AMC,PLAB,FMGE/NExT,NEET PG",Xi'an Jiaotong University College of Medicine,Xi'an,university
China,CN,"AMC,PLAB,FMGE/NExT,NEET PG",Xi'an Medical University,Xi'an,university
China,CN,"AMC,PLAB,FMGE/NExT,NEET PG",Xiamen University School of Medicine,Xiamen,university
China,CN,"AMC,PLAB,FMGE/NExT,NEET PG",Xiangnan University School of Medicine,Chenzhou,university
China,CN,"AMC,PLAB,FMGE/NExT,NEET PG","Xiangya School of Medicine, Central South University",Changsha,university
China,CN,"AMC,PLAB,FMGE/NExT,NEET PG",Xinjiang College of Traditional Chinese Medicine,Urumqi,university
China,CN,"AMC,PLAB,FMGE/NExT,NEET PG",Xinjiang Medical University,Urumqi,university
China,CN,"AMC,PLAB,FMGE/NExT,NEET PG",Xuzhou Medical University,Xuzhou,university
China,CN,"AMC,PLAB,FMGE/NExT,NEET PG",Yanbian University Health Science Center,Yanji,university
China,CN,"AMC,PLAB,FMGE/NExT,NEET PG",Yangtze University Medical School,Jingzhou,university
China,CN,"AMC,PLAB,FMGE/NExT,NEET PG",Yangzhou University College of Medicine,Yangzhou,university
China,CN,"AMC,PLAB,FMGE/NExT,NEET PG",Yichun University School of Medicine,Yichun,university
China,CN,"AMC,PLAB,FMGE/NExT,NEET PG",Yishui Medical School,Yishui,university
China,CN,"AMC,PLAB,FMGE/NExT,NEET PG",Youjiang Medical University for Nationalities,Baise,university
China,CN,"AMC,PLAB,FMGE/NExT,NEET PG",Yuzhou University School of Medicine,Chongqing,university
China,CN,"AMC,PLAB,FMGE/NExT,NEET PG",Zhejiang Chinese Medical University,Hangzhou,university
China,CN,"AMC,PLAB,FMGE/NExT,NEET PG",Zhejiang University,Hangzhou,university
China,CN,"AMC,PLAB,FMGE/NExT,NEET PG",Zhengzhou University Medical School,Zhengzhou,university
China,CN,"AMC,PLAB,FMGE/NExT,NEET PG","Zhongshan School of Medicine, Sun Yat-Sen University",Guangzhou,university
China,CN,"AMC,PLAB,FMGE/NExT,NEET PG",Zunyi Medical University,Zunyi,university
Georgia,GE,"AMC,PLAB,FMGE/NExT,NEET PG",Akaki Tsereteli State University Faculty of Medicine,Kutaisi,university
Georgia,GE,"AMC,PLAB,FMGE/NExT,NEET PG",Alte University School of Medicine,Tbilisi,university
Georgia,GE,"AMC,PLAB,FMGE/NExT,NEET PG",Avicenna - Batumi Medical University,Batumi,university
Georgia,GE,"AMC,PLAB,FMGE/NExT,NEET PG",Batumi Shota Rustaveli State University Faculty of Education and Science,Batumi,university
Georgia,GE,"AMC,PLAB,FMGE/NExT,NEET PG",BAU International University Faculty of Medicine,Batumi,university
Georgia,GE,"AMC,PLAB,FMGE/NExT,NEET PG",Caucasus International University Faculty of Medicine,Tbilisi,university
Georgia,GE,"AMC,PLAB,FMGE/NExT,NEET PG",Caucasus Medicine School,Tbilisi,university
Georgia,GE,"AMC,PLAB,FMGE/NExT,NEET PG",Central University of Europe Faculty of Medicine,Kutaisi,university
Georgia,GE,"AMC,PLAB,FMGE/NExT,NEET PG",Classical and Traditional Medicine Academy,Tbilisi,university
Georgia,GE,"AMC,PLAB,FMGE/NExT,NEET PG",Critical Care Medicine Institute,Tbilisi,university
Georgia,GE,"AMC,PLAB,FMGE/NExT,NEET PG",David Aghmashenebeli University of Georgia Faculty of Medicine,Tbilisi,university
Georgia,GE,"AMC,PLAB,FMGE/NExT,NEET PG",David Tvildiani Medical University AIETI Medical School,Tbilisi,university
Georgia,GE,"AMC,PLAB,FMGE/NExT,NEET PG",East European University Faculty of Healthcare Sciences,Tbilisi,university
Georgia,GE,"AMC,PLAB,FMGE/NExT,NEET PG",East-West University School of Medicine,Tbilisi,university
Georgia,GE,"AMC,PLAB,FMGE/NExT,NEET PG",European University Faculty of Medicine,Tbilisi,university
Georgia,GE,"AMC,PLAB,FMGE/NExT,NEET PG",Georgian American University,Tbilisi,university
Georgia,GE,"AMC,PLAB,FMGE/NExT,NEET PG",Georgian National University SEU Faculty of Medicine,Tbilisi,university
Georgia,GE,"AMC,PLAB,FMGE/NExT,NEET PG",Grigol Robakidze University School of Medicine,Tbilisi,university
Georgia,GE,"AMC,PLAB,FMGE/NExT,NEET PG",Ilia State University Faculty of Natural Sciences and Medicine,Tbilisi,university
Georgia,GE,"AMC,PLAB,FMGE/NExT,NEET PG",International Black Sea University School of Medicine,Tbilisi,university
Georgia,GE,"AMC,PLAB,FMGE/NExT,NEET PG",International University of Tbilisi School of Health,Tbilisi,university
Georgia,GE,"AMC,PLAB,FMGE/NExT,NEET PG",Ivane Javakhishvili Tbilisi State University Faculty of Medicine,Tbilisi,university
Georgia,GE,"AMC,PLAB,FMGE/NExT,NEET PG",Ken Walker International University Faculty of Medicine and Stomatology,Tbilisi,university
Georgia,GE,"AMC,PLAB,FMGE/NExT,NEET PG",Kutaisi Institute of Medicine,Kutaisi,university
Georgia,GE,"AMC,PLAB,FMGE/NExT,NEET PG",Medical Institute of Reconstruction Plastic Surgery and Dermocosmetology,Tbilisi,university
Georgia,GE,"AMC,PLAB,FMGE/NExT,NEET PG",New Vision University School of Medicine,Tbilisi,university
Georgia,GE,"AMC,PLAB,FMGE/NExT,NEET PG",Petre Shotadze Tbilisi Medical Academy Faculty of Medicine,Tbilisi,university
Georgia,GE,"AMC,PLAB,FMGE/NExT,NEET PG",Quality Control Teaching University of Georgia,Tbilisi,university
Georgia,GE,"AMC,PLAB,FMGE/NExT,NEET PG",Tbilisi Humanitarian Teaching University Faculty of Health,Tbilisi,university
Georgia,GE,"AMC,PLAB,FMGE/NExT,NEET PG",Tbilisi Medical Institute 'Vita',Tbilisi,university
Georgia,GE,"AMC,PLAB,FMGE/NExT,NEET PG",Tbilisi Medical Teaching University 'Hippocrates',Tbilisi,university
Georgia,GE,"AMC,PLAB,FMGE/NExT,NEET PG",Tbilisi National University 'Gaenati',Tbilisi,university
Georgia,GE,"AMC,PLAB,FMGE/NExT,NEET PG",Tbilisi State Medical University Faculty of Medicine,Tbilisi,university
Georgia,GE,"AMC,PLAB,FMGE/NExT,NEET PG",Tbilisi University 'Metekhi',Tbilisi,university
Georgia,GE,"AMC,PLAB,FMGE/NExT,NEET PG",University Geomedi LLC Faculty of Medicine,Tbilisi,university
Georgia,GE,"AMC,PLAB,FMGE/NExT,NEET PG",University of Georgia School of Health Sciences,Tbilisi,university
Georgia,GE,"AMC,PLAB,FMGE/NExT,NEET PG",University of Legia and Company Faculty of Medicine,Tbilisi,university
Georgia,GE,"AMC,PLAB,FMGE/NExT,NEET PG",University Sakartvelo Faculty of Medicine,Tbilisi,university
Hong Kong,HK,"AMC,PLAB,FMGE/NExT,NEET PG",Chinese University of Hong Kong Faculty of Medicine,Shatin,university
Hong Kong,HK,"AMC,PLAB,FMGE/NExT,NEET PG","Li Ka Shing Faculty of Medicine, University of Hong Kong",Pokfulam,university
India,IN,"AMC,PLAB,FMGE/NExT,NEET PG",A.C.S. Medical College and Hospital,Chennai,university
India,IN,"AMC,PLAB,FMGE/NExT,NEET PG",A.C.S.R. Government Medical College,Nellore,university
India,IN,"AMC,PLAB,FMGE/NExT,NEET PG",A.J. Institute of Medical Sciences and Research Centre,Mangalore,university
India,IN,"AMC,PLAB,FMGE/NExT,NEET PG",Aarupadai Veedu Medical College,Pondicherry,university
India,IN,"AMC,PLAB,FMGE/NExT,NEET PG","Abhishek I Mishra Memorial Medical College & Research, Bhiali",Durg,university
India,IN,"AMC,PLAB,FMGE/NExT,NEET PG",Acharya Shri Chander College of Medical Sciences,Sidhra,university
India,IN,"AMC,PLAB,FMGE/NExT,NEET PG",Adesh Institute of Medical Sciences & Research,Bathinda,university
India,IN,"AMC,PLAB,FMGE/NExT,NEET PG","Adesh Medical College and Hospital, Shahabad",Kurukshetra,university
India,IN,"AMC,PLAB,FMGE/NExT,NEET PG",Adichunchanagiri Institute of Medical Sciences,Bellur,university
India,IN,"AMC,PLAB,FMGE/NExT,NEET PG",Agartala Government Medical College,Agartala,university
India,IN,"AMC,PLAB,FMGE/NExT,NEET PG",Ajay Sangaal Institute of Medical Sciences and Ayushman Hospital,Shamli,university
India,IN,"AMC,PLAB,FMGE/NExT,NEET PG",Akash Institute of Medical Sciences & Research Centre,Bangalore,university
India,IN,"AMC,PLAB,FMGE/NExT,NEET PG",Al-Ameen Medical College,Vijayapura (Bijapur),university
India,IN,"AMC,PLAB,FMGE/NExT,NEET PG",Al-Azhar Medical College and Super Speciality Hospital,Thodupuzha,university
India,IN,"AMC,PLAB,FMGE/NExT,NEET PG",Al-Falah School of Medical Sciences & Research Centre,Faridabad,university
India,IN,"AMC,PLAB,FMGE/NExT,NEET PG","All India Institute of Medical Sciences, Bathinda",Bathinda,university
India,IN,"AMC,PLAB,FMGE/NExT,NEET PG","All India Institute of Medical Sciences, Bhopal",Bhopal,university
India,IN,"AMC,PLAB,FMGE/NExT,NEET PG","All India Institute of Medical Sciences, Bhubaneswar",Bhubaneswar,university
India,IN,"AMC,PLAB,FMGE/NExT,NEET PG","All India Institute of Medical Sciences, Bibinagar",Bibinagar,university
India,IN,"AMC,PLAB,FMGE/NExT,NEET PG","All India Institute of Medical Sciences, Bilaspur",Bilaspur,university
India,IN,"AMC,PLAB,FMGE/NExT,NEET PG","All India Institute of Medical Sciences, Deoghar",Deoghar,university
India,IN,"AMC,PLAB,FMGE/NExT,NEET PG","All India Institute of Medical Sciences, Gorakhpur",Gorakhpur,university
India,IN,"AMC,PLAB,FMGE/NExT,NEET PG","All India Institute of Medical Sciences, Guwahati",Guwahati,university
India,IN,"AMC,PLAB,FMGE/NExT,NEET PG","All India Institute of Medical Sciences, Jodhpur",Jodhpur,university
India,IN,"AMC,PLAB,FMGE/NExT,NEET PG","All India Institute of Medical Sciences, Kalyani",Kalyani,university
India,IN,"AMC,PLAB,FMGE/NExT,NEET PG","All India Institute of Medical Sciences, Madurai",Ramanathapuram,university
India,IN,"AMC,PLAB,FMGE/NExT,NEET PG","All India Institute of Medical Sciences, Mangalagiri",Mangalagiri,university
India,IN,"AMC,PLAB,FMGE/NExT,NEET PG","All India Institute of Medical Sciences, Nagpur",Nagpur,university
India,IN,"AMC,PLAB,FMGE/NExT,NEET PG","All India Institute of Medical Sciences, New Delhi",New Delhi,university
India,IN,"AMC,PLAB,FMGE/NExT,NEET PG","All India Institute of Medical Sciences, Patna",Patna,university
India,IN,"AMC,PLAB,FMGE/NExT,NEET PG","All India Institute of Medical Sciences, Raebareli",Raebareli,university
India,IN,"AMC,PLAB,FMGE/NExT,NEET PG","All India Institute of Medical Sciences, Raipur",Raipur,university
India,IN,"AMC,PLAB,FMGE/NExT,NEET PG","All India Institute of Medical Sciences, Rajkot",Rajkot,university
India,IN,"AMC,PLAB,FMGE/NExT,NEET PG","All India Institute of Medical Sciences, Rishikesh",Rishikesh,university
India,IN,"AMC,PLAB,FMGE/NExT,NEET PG",Alluri Sitaram Raju Academy of Medical Sciences,Eluru,university
India,IN,"AMC,PLAB,FMGE/NExT,NEET PG",Amala Institute of Medical Sciences,Thrissur,university
India,IN,"AMC,PLAB,FMGE/NExT,NEET PG",Amaltas Institute of Medical Sciences,Dewas,university
India,IN,"AMC,PLAB,FMGE/NExT,NEET PG",American International Institute of Medical Sciences,Udaipur,university
India,IN,"AMC,PLAB,FMGE/NExT,NEET PG",Amrita School of Medicine,Kochi,university
India,IN,"AMC,PLAB,FMGE/NExT,NEET PG","Amrita School of Medicine, Faridabad",Faridabad,university
India,IN,"AMC,PLAB,FMGE/NExT,NEET PG",Ananta Institute of Medical Sciences & Research Centre,Rajsamand,university
India,IN,"AMC,PLAB,FMGE/NExT,NEET PG",Ananya College of Medicine & Research,Ahmedabad,university
India,IN,"AMC,PLAB,FMGE/NExT,NEET PG",Andaman & Nicobar Islands Institute of Medical Sciences,Port Blair,university
India,IN,"AMC,PLAB,FMGE/NExT,NEET PG",Andhra Medical College,Visakhapatnam,university
India,IN,"AMC,PLAB,FMGE/NExT,NEET PG",Annaii Medical College and Hospital,Kanchipuram,university
India,IN,"AMC,PLAB,FMGE/NExT,NEET PG",Annapoorna Medical College and Hospital,Salem,university
India,IN,"AMC,PLAB,FMGE/NExT,NEET PG",Anugrah Narayan Magadh Medical College and Hospital,Gaya,university
India,IN,"AMC,PLAB,FMGE/NExT,NEET PG","Apollo Institute of Medical Sciences and Research, Chittoor",Chittoor,university
India,IN,"AMC,PLAB,FMGE/NExT,NEET PG","Apollo Institute of Medical Sciences and Research, Hyderabad",Hyderabad,university
India,IN,"AMC,PLAB,FMGE/NExT,NEET PG",Armed Forces Medical College,Pune,university
India,IN,"AMC,PLAB,FMGE/NExT,NEET PG",Army College of Medical Sciences,New Delhi,university
India,IN,"AMC,PLAB,FMGE/NExT,NEET PG",Arunai Medical College and Hospital,Tiruvannamalai,university
India,IN,"AMC,PLAB,FMGE/NExT,NEET PG",Arundathi Institute of Medical Sciences,Hyderabad,university
India,IN,"AMC,PLAB,FMGE/NExT,NEET PG","Ashwini Rural Medical College, Hospital and Research Centre",Solapur,university
India,IN,"AMC,PLAB,FMGE/NExT,NEET PG",Assam Medical College,Dibrugarh,university
India,IN,"AMC,PLAB,FMGE/NExT,NEET PG",Atal Bihari Vajpayee Institute of Medical Sciences and Dr. Ram Manohar Lohia Hospital,New Delhi,university
India,IN,"AMC,PLAB,FMGE/NExT,NEET PG",Autonomous State Medical College and Hospital Auraiya,Auraiya,university
India,IN,"AMC,PLAB,FMGE/NExT,NEET PG",Autonomous State Medical College and Hospital Firozabad,Firozabad,university
India,IN,"AMC,PLAB,FMGE/NExT,NEET PG",Autonomous State Medical College and Hospital Gonda,Gonda,university
India,IN,"AMC,PLAB,FMGE/NExT,NEET PG",Autonomous State Medical College and Hospital Kaushambi,Kaushambi,university
India,IN,"AMC,PLAB,FMGE/NExT,NEET PG",Autonomous State Medical College and Hospital Lakhimpur Kheri,Lakhimpur,university
India,IN,"AMC,PLAB,FMGE/NExT,NEET PG",Autonomous State Medical College Basti,Rampur,university
India,IN,"AMC,PLAB,FMGE/NExT,NEET PG",Autonomous State Medical College Etah,Etah,university
India,IN,"AMC,PLAB,FMGE/NExT,NEET PG",Autonomous State Medical College Fatehpur,Fatehpur,university
India,IN,"AMC,PLAB,FMGE/NExT,NEET PG",Autonomous State Medical College Ghazipur,Ghazipur,university
India,IN,"AMC,PLAB,FMGE/NExT,NEET PG",Autonomous State Medical College Hardoi,Hardoi,university
India,IN,"AMC,PLAB,FMGE/NExT,NEET PG",Autonomous State Medical College Kushinagar,Kushinagar,university
India,IN,"AMC,PLAB,FMGE/NExT,NEET PG",Autonomous State Medical College Mirzapur,Mirzapur,university
India,IN,"AMC,PLAB,FMGE/NExT,NEET PG",Autonomous State Medical College Pilibhit,Pilibhit,university
India,IN,"AMC,PLAB,FMGE/NExT,NEET PG",Autonomous State Medical College Pratapgarh,Pratapgarh,university
India,IN,"AMC,PLAB,FMGE/NExT,NEET PG",Autonomous State Medical College Siddharthnagar,Siddharthnagar,university
India,IN,"AMC,PLAB,FMGE/NExT,NEET PG",Autonomous State Medical College Sultanpur,Sultanpur,university
India,IN,"AMC,PLAB,FMGE/NExT,NEET PG","Autonomous State Medical College, Akbarpur",Akbarpur,university
India,IN,"AMC,PLAB,FMGE/NExT,NEET PG","Autonomous State Medical College, Lalitpur",Lalitpur,university
India,IN,"AMC,PLAB,FMGE/NExT,NEET PG","Autonomous State Medical College, Sonebhadra",Robertsganj,university
India,IN,"AMC,PLAB,FMGE/NExT,NEET PG",Ayaan Institute of Medical Sciences,Kanaka Mamidi,university
India,IN,"AMC,PLAB,FMGE/NExT,NEET PG",Azeezia Institute of Medical Science,Kollam,university
India,IN,"AMC,PLAB,FMGE/NExT,NEET PG",B.G.S. Global Institute of Medical Sciences,Bangalore,university
India,IN,"AMC,PLAB,FMGE/NExT,NEET PG","B.J. Government Medical College, Pune",Pune,university
India,IN,"AMC,PLAB,FMGE/NExT,NEET PG","B.J. Medical College, Ahmedabad",Ahmedabad,university
India,IN,"AMC,PLAB,FMGE/NExT,NEET PG",B.K.L. Walawalkar Rural Medical College,Chiplun,university
India,IN,"AMC,PLAB,FMGE/NExT,NEET PG",B.P.S. Government Medical College for Women,Sonepat,university
India,IN,"AMC,PLAB,FMGE/NExT,NEET PG",Baba Kina Ram Autonomous State Medical College and Hospital,Chandauli,university
India,IN,"AMC,PLAB,FMGE/NExT,NEET PG",Baba Raghav Das Medical College,Gorakhpur,university
India,IN,"AMC,PLAB,FMGE/NExT,NEET PG",Banas Medical College and Research Institute,Palanpur,university
India,IN,"AMC,PLAB,FMGE/NExT,NEET PG",Bangalore Medical College and Research Institute,Bangalore,university
India,IN,"AMC,PLAB,FMGE/NExT,NEET PG",Bankura Sammilani Medical College,Bankura,university
India,IN,"AMC,PLAB,FMGE/NExT,NEET PG",Barasat Government Medical College and Hospital,Barasat,university
India,IN,"AMC,PLAB,FMGE/NExT,NEET PG",Basaveshwara Medical College and Hospital,Chitradurga,university
India,IN,"AMC,PLAB,FMGE/NExT,NEET PG",Belgaum Institute of Medical Sciences,Belgaum,university
India,IN,"AMC,PLAB,FMGE/NExT,NEET PG",Believers Church Medical College and Hospital,Thiruvalla,university
India,IN,"AMC,PLAB,FMGE/NExT,NEET PG",Bhaarath Medical College and Hospital,Chennai,university
India,IN,"AMC,PLAB,FMGE/NExT,NEET PG",Bhagwan Mahavir Institute of Medical Sciences,Pawapuri,university
India,IN,"AMC,PLAB,FMGE/NExT,NEET PG",Bhagyoday Medical College,Kadi,university
India,IN,"AMC,PLAB,FMGE/NExT,NEET PG",Bharat Ratna Late Shri Atal Bihari Vajpyee Memorial Medical College,Rajnandgaon,university
India,IN,"AMC,PLAB,FMGE/NExT,NEET PG","Bharati Vidyapeeth (Deemed to be University) Medical College & Hospital, Sangli",Sangli,university
India,IN,"AMC,PLAB,FMGE/NExT,NEET PG","Bharati Vidyapeeth Medical College, Pune",Pune,university
India,IN,"AMC,PLAB,FMGE/NExT,NEET PG",Bharatratna Atal Bihari Vajpayee Medical College Pune,Pune,university
India,IN,"AMC,PLAB,FMGE/NExT,NEET PG",Bhaskar Medical College,Yenkapally,university
India,IN,"AMC,PLAB,FMGE/NExT,NEET PG",Bhima Bhoi Medical College & Hospital,Balangir,university
India,IN,"AMC,PLAB,FMGE/NExT,NEET PG",Bidar Institute of Medical Sciences,Bidar,university
India,IN,"AMC,PLAB,FMGE/NExT,NEET PG",Bundelkhand Medical College,Sagar,university
India,IN,"AMC,PLAB,FMGE/NExT,NEET PG",Burdwan Medical College,Burdwan,university
India,IN,"AMC,PLAB,FMGE/NExT,NEET PG",C.U. Shah Medical College,Surendra Nagar,university
India,IN,"AMC,PLAB,FMGE/NExT,NEET PG",Calcutta National Medical College,Kolkata,university
India,IN,"AMC,PLAB,FMGE/NExT,NEET PG",Career Institute of Medical Sciences & Hospital,Lucknow,university
India,IN,"AMC,PLAB,FMGE/NExT,NEET PG",Chalmeda Anand Rao Institute of Medical Sciences,Karimnagar,university
India,IN,"AMC,PLAB,FMGE/NExT,NEET PG",Chamarajanagar Institute of Medical Sciences,Chamarajanagar,university
India,IN,"AMC,PLAB,FMGE/NExT,NEET PG","Chandulal Chandrakar Memorial Government Medical College, Durg",Durg,university
India,IN,"AMC,PLAB,FMGE/NExT,NEET PG",Chengalpattu Medical College,Chengalpattu,university
India,IN,"AMC,PLAB,FMGE/NExT,NEET PG",Chettinad Hospital & Research Institute,Kancheepuram,university
India,IN,"AMC,PLAB,FMGE/NExT,NEET PG",Chhattisgarh Institute of Medical Sciences,Bilaspur,university
India,IN,"AMC,PLAB,FMGE/NExT,NEET PG",Chikkaballapura Institute of Medical Sciences,Chikkaballap,university
India,IN,"AMC,PLAB,FMGE/NExT,NEET PG",Chikkamagaluru Institute of Medical Sciences,Chikkamagaluru,university
India,IN,"AMC,PLAB,FMGE/NExT,NEET PG","Chintpurni Medical College and Hospital, Gurdaspur",Pathankot,university
India,IN,"AMC,PLAB,FMGE/NExT,NEET PG",Chirayu Medical College and Hospital,Bhopal,university
India,IN,"AMC,PLAB,FMGE/NExT,NEET PG",Chitradurga Medical College and Research Institute,Chitradurga,university
India,IN,"AMC,PLAB,FMGE/NExT,NEET PG","Christian Medical College, Ludhiana",Ludhiana,university
India,IN,"AMC,PLAB,FMGE/NExT,NEET PG","Christian Medical College, Vellore",Vellore,university
India,IN,"AMC,PLAB,FMGE/NExT,NEET PG",CMR Institute of Medical Sciences,Hyderabad,university
India,IN,"AMC,PLAB,FMGE/NExT,NEET PG",Coimbatore Medical College,Coimbatore,university
India,IN,"AMC,PLAB,FMGE/NExT,NEET PG",College of Medicine and J.N.M. Hospital,Kalyani,university
India,IN,"AMC,PLAB,FMGE/NExT,NEET PG",College of Medicine and Sagore Dutta Hospital,Kolkata,university
India,IN,"AMC,PLAB,FMGE/NExT,NEET PG","D.Y. Patil Medical College, Kolhapur",Kolhapur,university
India,IN,"AMC,PLAB,FMGE/NExT,NEET PG",D.Y. Patil University School of Medicine,Navi Mumbai,university
India,IN,"AMC,PLAB,FMGE/NExT,NEET PG",Darbhanga Medical College and Hospital,Leheriasarai,university
India,IN,"AMC,PLAB,FMGE/NExT,NEET PG",Datta Meghe Medical College Nagpur,Nagpur,university
India,IN,"AMC,PLAB,FMGE/NExT,NEET PG",Dayanand Medical College,Ludhiana,university
India,IN,"AMC,PLAB,FMGE/NExT,NEET PG",Deccan College of Medical Sciences,Hyderabad,university
India,IN,"AMC,PLAB,FMGE/NExT,NEET PG",Dhanalakshmi Srinivasan Institute of Medical Sciences and Hospital,Perambalur,university
India,IN,"AMC,PLAB,FMGE/NExT,NEET PG","Dhanalakshmi Srinivasan Medical College and Hospital, Perambalur",Siruvachur,university
India,IN,"AMC,PLAB,FMGE/NExT,NEET PG",Dharanidhar Medical College and Hospital (DDMCH),Keonjhar,university
India,IN,"AMC,PLAB,FMGE/NExT,NEET PG",Dhubri Medical College,Dhubri,university
India,IN,"AMC,PLAB,FMGE/NExT,NEET PG",Diamond Harbour Government Medical College and Hospital,Diamond Harbour,university
India,IN,"AMC,PLAB,FMGE/NExT,NEET PG","Diphu Medical College and Hospital, Assam",Diphu,university
India,IN,"AMC,PLAB,FMGE/NExT,NEET PG",Dr. B.R. Ambedkar Medical College,Bangalore,university
India,IN,"AMC,PLAB,FMGE/NExT,NEET PG",Dr. B.R. Ambedkar State Institute of Medical Sciences SAS Nagar Mohali,Mohali,university
India,IN,"AMC,PLAB,FMGE/NExT,NEET PG",Dr. B.S. Kushwah Institute of Medical Sciences,Kanpur,university
India,IN,"AMC,PLAB,FMGE/NExT,NEET PG",Dr. Baba Saheb Ambedkar Medical College,New Delhi,university
India,IN,"AMC,PLAB,FMGE/NExT,NEET PG",Dr. Balasaheb Vikhe Patil Rural Medical College,Loni,university
India,IN,"AMC,PLAB,FMGE/NExT,NEET PG",Dr. Chandramma Dayananda Sagar Institute of Medical Education and Research,Hubli,university
India,IN,"AMC,PLAB,FMGE/NExT,NEET PG","Dr. D.Y. Patil Medical College, Hospital and Research Centre",Pimpri,university
India,IN,"AMC,PLAB,FMGE/NExT,NEET PG",Dr. Kiran C. Patel Medical College and Research Institute,Bharuch,university
India,IN,"AMC,PLAB,FMGE/NExT,NEET PG",Dr. KNS Memorial Institute of Medical Sciences,Barabanki,university
India,IN,"AMC,PLAB,FMGE/NExT,NEET PG",Dr. M.G.R. Educational and Research Institute (Deemed University),Bangalore,university
India,IN,"AMC,PLAB,FMGE/NExT,NEET PG",Dr. M.K. Shah Medical College & Research Centre,Ahmedabad,university
India,IN,"AMC,PLAB,FMGE/NExT,NEET PG","Dr. Moopen's Medical College, Wayanad",Arapetta,university
India,IN,"AMC,PLAB,FMGE/NExT,NEET PG",Dr. N. Y. Tasgaonkar Institute of Medical Science,Raigad,university
India,IN,"AMC,PLAB,FMGE/NExT,NEET PG",Dr. N.D. Desai Faculty of Medical Science and Research,Nadiad,university
India,IN,"AMC,PLAB,FMGE/NExT,NEET PG",Dr. Panjabrao Deshmukh Memorial Medical College,Amravati,university
India,IN,"AMC,PLAB,FMGE/NExT,NEET PG",Dr. Patnam Mahender Reddy Institute of Medical Sciences,,university
India,IN,"AMC,PLAB,FMGE/NExT,NEET PG",Dr. Pinnamaneni Siddhartha Institute of Medical Sciences,Chinna Avutapalli,university
India,IN,"AMC,PLAB,FMGE/NExT,NEET PG",Dr. Radhakrishnan Government Medical College,Hamirpur,university
India,IN,"AMC,PLAB,FMGE/NExT,NEET PG","Dr. Rajendra Gode Medical College, Amravati",Amravati,university
India,IN,"AMC,PLAB,FMGE/NExT,NEET PG",Dr. Rajendra Prasad Government Medical College,Tanda,university
India,IN,"AMC,PLAB,FMGE/NExT,NEET PG",Dr. Ram Manohar Lohia Institute of Medical Sciences,Lucknow,university
India,IN,"AMC,PLAB,FMGE/NExT,NEET PG",Dr. S.N. Medical College,Jodhpur,university
India,IN,"AMC,PLAB,FMGE/NExT,NEET PG",Dr. S.S. Tantia Medical College Hospital and Research Centre,Sri Ganganagar,university
India,IN,"AMC,PLAB,FMGE/NExT,NEET PG","Dr. Shankarrao Chavan Government Medical College, Nanded",Nanded,university
India,IN,"AMC,PLAB,FMGE/NExT,NEET PG",Dr. Somervell Memorial CSI Hospital & Medical College,Thiruvananthapuram,university
India,IN,"AMC,PLAB,FMGE/NExT,NEET PG",Dr. Ulhas Patil Medical College & Hospital,Jalgaon,university
India,IN,"AMC,PLAB,FMGE/NExT,NEET PG",Dr. V.R.K. Women's Medical College,Aziznagar,university
India,IN,"AMC,PLAB,FMGE/NExT,NEET PG",Dr. Vaishampayan Memorial Medical College,Solapur,university
India,IN,"AMC,PLAB,FMGE/NExT,NEET PG",Dr. Vasantrao Pawar Medical College Hospital and Research Centre,Nashik,university
India,IN,"AMC,PLAB,FMGE/NExT,NEET PG",Dr. Vithalrao Vikhe Patil Foundation's Medical College,Ahmednagar,university
India,IN,"AMC,PLAB,FMGE/NExT,NEET PG",Dr. Yashwant Singh Parmar Government Medical College Nahan,Nahan,university
India,IN,"AMC,PLAB,FMGE/NExT,NEET PG","DRIEMS Institute of Health Sciences and Hospital, Kairapari",Cuttak,university
India,IN,"AMC,PLAB,FMGE/NExT,NEET PG",E.S.I.C. Medical College & Postgraduate Institute of Medical Sciences and Research,Chennai,university
